{
  "content_id": "greg-humanizer-negpar",
  "brand": "acme-cosmos",
  "platform": "twitter",
  "format": "text",
  "variants": [
    { "label": "recommended", "text": "This isn't just a beta, it's a movement of sixty builders shipping usable demos this weekend." },
    { "label": "variant-a", "text": "Sixty builders showed up and every single demo went out as a usable link people can open here." },
    { "label": "variant-b", "text": "We asked for working demos. Sixty arrived. Here is the complete weekend project recap for all." }
  ]
}
