{
  "content_id": "greg-fabrication-clean",
  "brand": "acme-cosmos",
  "platform": "twitter",
  "format": "text",
  "variants": [
    { "label": "recommended", "text": "The beta wrapped and sixty builders shipped usable demos across the full weekend run today." },
    { "label": "variant-a", "text": "Sixty builders showed up and every single demo went out as a usable link people can open here." },
    { "label": "variant-b", "text": "We asked for working demos. Sixty arrived. Here is the complete weekend project recap for all." }
  ]
}
