{
  "content_id": "lint-selftest-placeholder",
  "brand": "acme-cosmos",
  "platform": "twitter",
  "format": "text",
  "variants": [
    { "label": "recommended", "text": "The beta wrapped and {METRIC} builders shipped usable demos across the weekend run." },
    { "label": "variant-a", "text": "Sixty builders showed up and every single demo went out as a usable link people use." },
    { "label": "variant-b", "text": "We asked for working demos. Sixty arrived. Here is the complete weekend project recap." }
  ]
}
