{
  "content_id": "greg-humanizer-inflation",
  "brand": "acme-cosmos",
  "platform": "twitter",
  "format": "text",
  "variants": [
    { "label": "recommended", "text": "This pivotal beta wrapped and underscores everything the Acme Cosmos community has built so far." },
    { "label": "variant-a", "text": "Sixty builders showed up and every single demo went out as a usable link people can open." },
    { "label": "variant-b", "text": "We asked for working demos. Sixty arrived. Here is the complete weekend recap for all." }
  ]
}
