{
  "content_id": "lint-selftest-em-dash",
  "brand": "acme-cosmos",
  "platform": "twitter",
  "format": "text",
  "variants": [
    { "label": "recommended", "text": "The beta wrapped—and the demos shipped live for everyone to open and use." },
    { "label": "variant-a", "text": "Sixty builders showed up and every single demo went out as a usable link." },
    { "label": "variant-b", "text": "We asked for working demos. Sixty arrived. Here is the complete weekend recap." }
  ]
}
