{
  "content_id": "greg-voice-financial",
  "brand": "acme-cosmos",
  "platform": "twitter",
  "format": "text",
  "variants": [
    { "label": "recommended", "text": "The floor price keeps climbing and the market cap looks ready to break out for Acme Cosmos." },
    { "label": "variant-a", "text": "Sixty builders showed up and every single demo went out as a usable link people can open." },
    { "label": "variant-b", "text": "We asked for working demos. Sixty arrived. Here is the complete weekend recap for all." }
  ]
}
