{
  "content_id": "greg-voice-clean",
  "brand": "acme-cosmos",
  "platform": "twitter",
  "format": "text",
  "variants": [
    { "label": "recommended", "text": "Sixty builders spent the weekend shipping demos you can open in the Acme Cosmos beta." },
    { "label": "variant-a", "text": "Every single demo went out as a usable link people can open, built across one weekend." },
    { "label": "variant-b", "text": "We asked for working demos. Sixty arrived. Here is the complete weekend recap for all." }
  ]
}
